<?xml version="1.0" encoding="UTF-8" ?>
<team xmlns="http://www.w3schools.com" xmlns:xsi="http://www.w3.org/2001/XMLSchema-instance" xsi:schemaLocation="http://www.w3schools.com output.xsd">
<person position="kapitan" id="i1">
<name>
</name>
<city>
</city>
<salary>
</salary>
</person>
<person position="vyvojar" id="i2">
<name>
</name>
<salary>
</salary>
</person>
<person position="vyvojar" id="i3">
<name>
</name>
<salary>
</salary>
</person>
<person position="tester" id="i4">
<name>
</name>
<city>
</city>
<salary>
</salary>
</person>
</team>
